<?xml version="1.0" encoding="UTF-8"?>
<!ELEMENT researches (research*)>
<!ELEMENT research (name, desc)>
<!ELEMENT name (#PCDATA)>
<!ELEMENT desc (#PCDATA)>